Id,Project,Module,Issue,Duration,Description,Tech Stack
1,FNCCI,Company Module,Multiple government registration,1,"Individual company add for multiple registered organization, delete api for registered organization done",Spring Boot
2,FNCCI,Company Module,Field addition,1,Required fields are added in the company entities and dtos based on the requirement changes,Spring Boot
3,FNCCI,Company Module,Excel creation,1,Excel creator utility created after some research,Spring Boot
4,FNCCI,Company Module,[Feature] Download company record in excel,2,Company download using excel utility.,Spring Boot
5,FNCCI,Company Module,[Bug] Updating company caused index out of bound issue,2,Issue hasn’t been solved. The reason behind the bug is found but not solved.,Mapstruct
