Id,Project,Module,Issue,Duration,Description,Tech Stack
1,FNCCI,Company Module,Schema changes,1,Some minor changes based on the requirements,Spring Boot
2,FNCCI,Company Module,Circular dependency issue,1,Company add issue solved in service layer,Spring Boot
3,FNCCI,Company Module,Company add api,1,Company add api completed,Spring Boot
4,FNCCI,Company Module,Null issue in individual company add,1,Individual company add api completed,Spring Boot
5,FNCCI,Company Module,Update company,4,"Update api for company, validation of fields during update and using mappers to update the data",Spring Boot
6,FNCCI,Company Module,Update company,,Using mappers to update the data on PUT request,Spring Boot
